{"$schema":"https://json-schema.org/draft/2020-12/schema","$id":"https://kidults.example/schemas/engine-run-v2.schema.json","title":"AGCI-OS Engine v2 Run","type":"object","additionalProperties":false,"required":["run_id","run_mode","fixture_id","fixture_classification","generated_at","engine_contract_id","autonomous_operating_contract_id","state","deterministic","fail_closed","input_record_count","admitted_record_count","quarantined_record_count","manual_review_count","admitted_records","quarantined_records","review_required","market_events","evidence_graph","market_graph","cluster_discovery","index_generation","stage_results","invariants","publication_eligible","production_eligible","run_fingerprint"],"properties":{"run_id":{"type":"string","minLength":1},"run_mode":{"const":"CONTRACT_FIXTURE_ONLY"},"fixture_id":{"type":"string"},"fixture_classification":{"const":"CONTRACT_TEST_FIXTURE_ONLY"},"generated_at":{"type":"string","format":"date-time"},"engine_contract_id":{"type":"string"},"autonomous_operating_contract_id":{"type":"string"},"state":{"const":"FOUNDATION_PREFLIGHT_PASS"},"deterministic":{"const":true},"fail_closed":{"const":true},"input_record_count":{"type":"integer","minimum":1},"admitted_record_count":{"type":"integer","minimum":0},"quarantined_record_count":{"type":"integer","minimum":0},"manual_review_count":{"type":"integer","minimum":0},"admitted_records":{"type":"array"},"quarantined_records":{"type":"array"},"review_required":{"type":"array"},"market_events":{"type":"array"},"evidence_graph":{"type":"object"},"market_graph":{"type":"object"},"cluster_discovery":{"type":"object"},"index_generation":{"type":"object"},"stage_results":{"type":"array","minItems":13},"invariants":{"type":"object"},"publication_eligible":{"const":false},"production_eligible":{"const":false},"run_fingerprint":{"type":"string","pattern":"^sha256:[a-f0-9]{64}$"}}}
