{"run_id":"engine-foundation-preflight-r1","run_mode":"CONTRACT_FIXTURE_ONLY","fixture_id":"engine-foundation-preflight-input-v1","fixture_classification":"CONTRACT_TEST_FIXTURE_ONLY","generated_at":"2026-08-16T14:30:00+09:00","engine_contract_id":"engine-agci-os-v2-contract-v1","autonomous_operating_contract_id":"autonomous-operating-contract-v1","state":"FOUNDATION_PREFLIGHT_PASS","deterministic":true,"fail_closed":true,"input_record_count":8,"admitted_record_count":4,"quarantined_record_count":4,"manual_review_count":1,"admitted_records":[{"record_id":"fixture-authority-001","source_key":"fixture-authority-source:AUTH-001","provider_id":"fixture-authority-source","provider_record_id":"AUTH-001","record_kind":"AUTHORITY_METADATA","provider_category":"museum-fashion","title":"House A Evening Dress","maker":"House A","object_type":"dress","production_year":1955,"observed_at":"2026-08-15T10:00:00Z","event_at":null,"rights_state":"CC0_METADATA","provenance_reference":"fixture://authority/AUTH-001","sale_status":null,"price":null,"currency":null,"canonical_candidate_key":"house-a|house-a-evening-dress|1955","identity_state":"CANDIDATE_KEY_ONLY","market_event_type":null,"index_eligible":false,"publication_eligible":false,"production_eligible":false},{"record_id":"fixture-identity-conflict-001","source_key":"fixture-authority-source:AUTH-002","provider_id":"fixture-authority-source","provider_record_id":"AUTH-002","record_kind":"AUTHORITY_METADATA","provider_category":"museum-fashion","title":"House B Evening Dress","maker":"House B","object_type":"dress","production_year":1955,"observed_at":"2026-08-15T11:00:00Z","event_at":null,"rights_state":"CC0_METADATA","provenance_reference":"fixture://authority/AUTH-002","sale_status":null,"price":null,"currency":null,"canonical_candidate_key":"house-b|house-b-evening-dress|1955","identity_state":"REVIEW_REQUIRED","market_event_type":null,"index_eligible":false,"publication_eligible":false,"production_eligible":false},{"record_id":"fixture-listing-001","source_key":"fixture-market-source:LIST-001","provider_id":"fixture-market-source","provider_record_id":"LIST-001","record_kind":"LISTING","provider_category":"vintage-fashion","title":"House A Evening Dress","maker":"House A","object_type":"dress","production_year":1955,"observed_at":"2026-08-16T02:05:00Z","event_at":"2026-08-10T12:00:00Z","rights_state":"COMMERCIAL_USE_CLEARED","provenance_reference":"fixture://market/LIST-001","sale_status":"LISTED","price":15000,"currency":"USD","canonical_candidate_key":"house-a|house-a-evening-dress|1955","identity_state":"CANDIDATE_KEY_ONLY","market_event_type":"LISTING","index_eligible":false,"publication_eligible":false,"production_eligible":false},{"record_id":"fixture-sold-001","source_key":"fixture-market-source:TX-001","provider_id":"fixture-market-source","provider_record_id":"TX-001","record_kind":"TRANSACTION","provider_category":"vintage-fashion","title":"House A Evening Dress","maker":"House A","object_type":"dress","production_year":1955,"observed_at":"2026-08-16T02:00:00Z","event_at":"2026-08-01T12:00:00Z","rights_state":"COMMERCIAL_USE_CLEARED","provenance_reference":"fixture://market/TX-001","sale_status":"SOLD","price":12500,"currency":"USD","canonical_candidate_key":"house-a|house-a-evening-dress|1955","identity_state":"CANDIDATE_KEY_ONLY","market_event_type":"SOLD_TRANSACTION","index_eligible":false,"publication_eligible":false,"production_eligible":false}],"quarantined_records":[{"record_id":"fixture-missing-provenance-001","source_key":"fixture-market-source:TX-003","reasons":["PROVENANCE_REFERENCE_MISSING"],"disposition":"QUARANTINED_NOT_INDEX_ELIGIBLE"},{"record_id":"fixture-missing-rights-001","source_key":"fixture-market-source:TX-002","reasons":["RIGHTS_STATE_MISSING"],"disposition":"QUARANTINED_NOT_INDEX_ELIGIBLE"},{"record_id":"fixture-sold-001-duplicate","source_key":"fixture-market-source:TX-001","reasons":["DUPLICATE_SOURCE_RECORD"],"disposition":"QUARANTINED_NOT_INDEX_ELIGIBLE"},{"record_id":"fixture-stale-authority-001","source_key":"fixture-authority-source:AUTH-STALE-001","reasons":["STALE_OBSERVATION"],"disposition":"QUARANTINED_NOT_INDEX_ELIGIBLE"}],"review_required":[{"record_id":"fixture-identity-conflict-001","claimed_canonical_key":"house-a|house-a-evening-dress|1955","computed_canonical_key":"house-b|house-b-evening-dress|1955","reason":"CLAIMED_CANONICAL_KEY_CONFLICT","auto_merge":false}],"market_events":[{"market_event_id":"market-event:fixture-market-source:LIST-001","source_record_id":"fixture-listing-001","canonical_candidate_key":"house-a|house-a-evening-dress|1955","event_type":"LISTING","event_at":"2026-08-10T12:00:00Z","price":15000,"currency":"USD","listing_is_sale":false,"publication_eligible":false},{"market_event_id":"market-event:fixture-market-source:TX-001","source_record_id":"fixture-sold-001","canonical_candidate_key":"house-a|house-a-evening-dress|1955","event_type":"SOLD_TRANSACTION","event_at":"2026-08-01T12:00:00Z","price":12500,"currency":"USD","listing_is_sale":false,"publication_eligible":false}],"evidence_graph":{"source_record_nodes":4,"canonical_candidate_nodes":2,"evidence_assertion_nodes":4,"market_event_nodes":2,"total_nodes":12,"source_to_assertion_edges":4,"assertion_to_entity_edges":4,"source_to_market_event_edges":2,"market_event_to_entity_edges":2,"total_edges":12},"market_graph":{"entity_nodes":2,"event_nodes":2,"sold_transaction_nodes":1,"listing_nodes":1,"event_to_entity_edges":2,"listing_is_sale":false,"market_metrics_verified":0},"cluster_discovery":{"test_threshold_only":3,"production_threshold_status":"NOT_CALIBRATED","discovered_count":1,"clusters":[{"cluster_id":"fixture-cluster-001","cluster_state":"DISCOVERED","canonical_candidate_key":"house-a|house-a-evening-dress|1955","observation_count":3,"source_family_count":2,"recommended_label":"Fixture Fashion Cluster","autonomous_recommendation":true,"human_approval_required":true,"approved_vertical_id":null,"public_promotion":false}],"approved_dynamic_vertical_count":0},"index_generation":{"vertical_intelligence":"NOT_COMPUTED","kidult_500":"NOT_COMPUTED","kidult_100":"NOT_COMPUTED","reason":"CONTRACT_FIXTURE_ONLY_AND_NO_APPROVED_DYNAMIC_VERTICAL"},"stage_results":[{"order":1,"stage":"OBSERVE","status":"PASS"},{"order":2,"stage":"COLLECT","status":"PASS"},{"order":3,"stage":"QUARANTINE","status":"PASS"},{"order":4,"stage":"NORMALIZE","status":"PASS"},{"order":5,"stage":"RESOLVE_ENTITIES","status":"PASS_WITH_REVIEW"},{"order":6,"stage":"VALIDATE_RIGHTS_PROVENANCE_FRESHNESS","status":"PASS_FAIL_CLOSED"},{"order":7,"stage":"BUILD_EVIDENCE_GRAPH","status":"PASS"},{"order":8,"stage":"BUILD_MARKET_GRAPH","status":"PASS"},{"order":9,"stage":"DETECT_CLUSTERS","status":"PASS_DISCOVERY_ONLY"},{"order":10,"stage":"ASSESS","status":"SKIPPED_NO_TRACK_B_ASSESSMENT"},{"order":11,"stage":"GENERATE_INDEXES","status":"SKIPPED_INSUFFICIENT_EVIDENCE"},{"order":12,"stage":"PROJECT","status":"PASS_FAIL_CLOSED"},{"order":13,"stage":"MONITOR","status":"READY"}],"invariants":{"missing_to_zero":false,"provider_to_portal_direct_path":false,"provider_to_index_direct_path":false,"listing_is_sale":false,"unsupported_metric_fabrication":false,"autonomous_public_vertical_promotion":false,"production_mutation":false},"publication_eligible":false,"production_eligible":false,"run_fingerprint":"sha256:a7f7b04d4b1f17dd1b22d17166f2ca605e347d69edcda5da7ca72b2c6c99ee04"}
